{
  "name": "ai-mesh-pane-viewer",
  "version": "0.2.0",
  "description": "Real-time subagent monitoring in terminal panes (WezTerm, Zellij, tmux)",
  "author": {
    "name": "Fortium Partners",
    "email": "support@fortiumpartners.com",
    "url": "https://github.com/FortiumPartners"
  },
  "repository": "https://github.com/FortiumPartners/ai-mesh-pane-viewer",
  "license": "MIT",
  "keywords": ["monitoring", "subagent", "wezterm", "zellij", "tmux", "terminal", "ai-mesh"],
  "hooks": "./hooks/hooks.json",
  "commands": "./commands"
}
